,id,reviewContent,createDate,reviewScore
1538,3354352452,맛있어요 잘 먹겠습니다,2022-01-25T07:18:33.179+0000,5
1539,3355643598,선물로 보내드렸는데 만족하시네요,2022-01-27T01:19:30.528+0000,5
1540,3353594092,락토핏 가성비 좋아요 잘 먹고있어요,2022-01-24T04:25:56.877+0000,5
1541,3342198281,싸게잘삿네요 수고하세요,2022-01-08T11:18:05.601+0000,4
1542,3335555011,저렴하게 구매해서 좋아요 다른 제품보다 좋아서 정착했어요,2021-12-30T06:36:43.363+0000,5
1543,3355210596,상품 잘 받았습니다 배송이 좀 오래 걸렸지만,2022-01-26T09:06:18.953+0000,4
1544,3356075035,배송도빠르고 상품 잘받았습니다,2022-01-27T11:46:58.810+0000,5
1545,3356871602,가격도 싸고 좋으거같아요,2022-01-28T22:21:30.027+0000,5
1546,3357559642,매일 잘 먹고있어요,2022-01-30T09:27:21.585+0000,5
1547,3348721780,유통기한도 넉넉하고 배송도 빠르고 좋아요 신제품인데 할인할때 잘샀어요,2022-01-17T11:07:54.144+0000,4
1548,3341960477,잘 먹고 있어요 만족합니다,2022-01-08T05:17:59.626+0000,5
1549,3357921010,선물했어요 좋아하시네요,2022-01-31T13:24:49.383+0000,5
1550,3338524084,할인해서 잘 구입했습니다  늘 먹는거라 여분 구입 했고요,2022-01-04T02:50:14.794+0000,5
1551,3356760070,포장도 꼼꼼하게 잘 왔어요,2022-01-28T12:31:26.422+0000,5
1552,3334457154,제품의 경우 회사는 사전에 이를 회사의 의견과 견해가 반영되지 않았다 하더라도 좋은 성과를 거둘 것이다,2021-12-28T23:43:47.447+0000,5
1553,3355611937,배송도 빠르고 믿고먹는 제품입니다,2022-01-27T00:35:54.565+0000,5
1554,3355592880,잘 챙겨먹는중입니다 감사합니다,2022-01-27T00:03:54.488+0000,5
1555,3337550877,할인받아서 정말 잘 샀네요 잘먹겠습니다,2022-01-02T11:47:33.747+0000,5
1556,3353992664,조아요 믿고먹는 종근당,2022-01-24T16:18:36.604+0000,5
1557,3353855297,배송도 엄청 빠르고 몇년째 꾸준히 챙겨먹어요,2022-01-24T11:45:26.241+0000,5
1558,3336093669,느무느무일찍 도착해서 깜놀했네요 다 먹으면 다시 올께요,2021-12-31T01:41:59.278+0000,5
1559,3358155721,좋아여좋아여좋아여좋아여,2022-02-01T13:23:05.876+0000,5
1560,3342523747,좋아요 잘 받았습니다,2022-01-09T02:57:31.322+0000,5
1561,3342482473,항상 잘 먹고 있습니다,2022-01-09T02:04:28.971+0000,5
1562,3331571261,일요일저녁에 주문하고 월요일 도착배송 완전 빠르네요 할인율이 높아서 설 선물할꺼 미리 주문했네요,2021-12-24T09:20:45.686+0000,5
1563,3328594107,운좋게 구매 시점에 라이브쇼핑 특가로 좋은 제품 저렴하게 구매했습니다 배송은 아주 빨리 도착했고 제품 포장도 꼼꼼하게 보내주셨어요,2021-12-20T12:51:22.203+0000,5
1564,3357182158,빠른배송 합리적 가격,2022-01-29T10:14:35.403+0000,5
1565,3353899394,항상 챙겨먹는데 행사가로 구매해서 좋습니다,2022-01-24T12:54:39.346+0000,5
1566,3361572273,좋아요,2022-02-07T05:48:55.999+0000,5
1567,3348993504,가격 저렴하게 삿어요 꾸준히먹어볼려구여 감사합니다,2022-01-18T01:34:57.820+0000,5
1568,3356127412,배송 빠르고 잘 포장되어 왔어요,2022-01-27T12:55:30.294+0000,5
1569,3372770262,좋아요 좋아요 좋아요,2022-02-21T18:36:52.188+0000,5
1570,3357237597,배송도 빠르고 상태도 조아요,2022-01-29T12:49:08.438+0000,5
1571,3339918809,항상 먹은 제품 세일해서 쟁여놨어요,2022-01-05T13:47:15.891+0000,5
1572,3356716132,먹기편하고  맛도 좋아요,2022-01-28T10:59:26.640+0000,4
1573,3354145502,배송이 너무 빠르고 좋아요 항상 챙겨먹고있어요,2022-01-25T02:16:41.433+0000,5
1574,3352951728,늘 먹는겁니당 잘먹고있어요,2022-01-23T04:50:18.184+0000,5
1575,3356981618,빠른배송 감사합니다,2022-01-29T02:38:34.924+0000,5
1576,3351747720,배송 엄청 빨랐고 맛있으면서 하루 한개만 먹으면 되서 부담없어요,2022-01-21T08:40:35.679+0000,5
1577,3357425906,유산균은 필수인 시대,2022-01-30T02:57:32.527+0000,5
1578,3357556077,좋은 선물 했습니다,2022-01-30T09:14:19.010+0000,5
1579,3355839487,배송빠르고 서비스도 좋아요,2022-01-27T06:18:08.202+0000,5
1580,3356405920,명절선물로 구입했어요,2022-01-28T02:27:32.298+0000,5
1581,3356373933,먹기 편하고 맛도 있어요,2022-01-28T01:52:40.608+0000,5
1582,3347870906,먹기 편하고 좋은데 포장이 너무 과한듯합니다 간단히 포장하여 환경 개선에도 도움이되고 포장비도 아꼈으면 더욱좋겠습니다,2022-01-16T05:53:51.991+0000,5
1583,3355769498,잘먹고있습니다 감사합니다,2022-01-27T04:36:41.884+0000,5
1584,3341644551,쟁여두고 챙겨먹습니나,2022-01-07T15:27:23.998+0000,5
1585,3339394464,만족합니다 장건강은 믿고 맡깁니다,2022-01-05T03:43:01.722+0000,5
1586,3351042739,쟁여놓고 먹습니다 선물하기도 좋아요,2022-01-20T11:07:22.519+0000,5
1587,3359194646,잘먹을게요,2022-02-04T03:58:30.312+0000,5
1588,3355418056,배송이 빠릅니다 저렴하게 샀어요,2022-01-26T13:14:26.296+0000,5
1589,3336644878,착한가격에 겟 꾸준히 먹고있어요좋아요,2021-12-31T16:42:22.718+0000,5
1590,3341592736,배송이 빨라서  좋았네요,2022-01-07T13:47:36.139+0000,5
1591,3355932158,배송이 너무 빨라서 놀랐음요,2022-01-27T08:23:37.455+0000,5
1592,3335199396,유산균은 종근당이죠  먹기편해요 배송도 빨랐구요,2021-12-29T19:13:53.249+0000,5
1593,3350253652,꾸준히 먹어보려구요 빠른 배송 감사합니다,2022-01-19T11:12:43.969+0000,5
1594,3339953719,장건강에 효과 많이 보고 있어여,2022-01-05T14:32:52.544+0000,5
1595,3353962331,아이들도 잘먹고 저렴한가격에 잘구매했습니다,2022-01-24T14:45:06.822+0000,5
1596,3344284784,년넘게 꾸준히 믿고 먹는 제품이예요 먹기 편하고 양도 적당하고 맛있기도 해요 다 먹으면 재구매 해야겠어요,2022-01-11T12:09:45.464+0000,5
1597,3342155058,꾸준히 먹고 있어요,2022-01-08T10:09:28.075+0000,5
1598,3329927733,락토핏 왜 이제알았을까요  먹기불편 냄새날줄 알았는데 아침에 봉하고 물 한잔마심  세상 간편하고  좋네요,2021-12-22T07:56:50.109+0000,5
1599,3356674797,꾸준히 먹는 제품입니다,2022-01-28T09:28:32.851+0000,3
1600,3342428407,가격도 저렴하고 맛도 좋아요,2022-01-09T00:47:11.768+0000,5
1601,3355389306,아들이먹을려고구입했어요,2022-01-26T12:41:57.325+0000,5
1602,3341155302,배송빠르고 품질 좋아요,2022-01-07T04:12:25.296+0000,5
1603,3351900994,배송이 엄청빠르네요 포장도 꼼꼼해요,2022-01-21T12:20:44.281+0000,4
1604,3338413613,역시 락토핏이 가격도 괜찮고 효과도 만점이에요,2022-01-03T22:43:00.032+0000,5
1605,3331006215,간 영양제랑 같이 먹으려고 샀습니다 먹기 편해서 좋아요 잘 맞으면 계속 먹을 계획입니다,2021-12-23T13:54:47.153+0000,5
1606,3340493507,효과가 좋고  먹기도 좋아요,2022-01-06T08:22:39.553+0000,5
1607,3340240695,맛있고 간편하게 먹기 좋아요,2022-01-06T03:14:25.691+0000,5
1608,3338887865,배송빠르고 유통기한 년넘게 남았네요,2022-01-04T10:41:31.701+0000,5
1609,3357130100,빠른 배송 감사합니다,2022-01-29T07:44:05.042+0000,5
1610,3356031916,전체적으로만족합니다,2022-01-27T10:49:27.216+0000,5
1611,3355333112,너무 맛있어요 잘먹겠습니당,2022-01-26T11:39:08.670+0000,5
1612,3337233496,항상 먹는거예요 저렴하게 구매했습니다 감사합니다,2022-01-02T01:51:26.388+0000,5
1613,3330990616,부모님 선물로 재구매했어요 먹기 편해서 좋아하십니다 알약형 보다 더 잘 챙겨드시구요,2021-12-23T13:33:29.147+0000,5
1614,3355844925,할인혜택이 너무 좋아요,2022-01-27T06:26:04.739+0000,5
1615,3340655050,잘받았습니다 감사합니다,2022-01-06T11:38:17.118+0000,5
1616,3353287188,아이들이 좋아하는 유산균 먹기 편하고 좋아요,2022-01-23T14:48:59.773+0000,5
1617,3351689879,선물용으로 구입했는데 배송도 빠르고 저렴하고 좋아요,2022-01-21T07:22:38.493+0000,5
1618,3354401878,늘 엄마가 드시는 거라 주문합니다,2022-01-25T08:23:36.188+0000,4
1619,3356156716,명절 선물로 준비했어요,2022-01-27T13:34:56.298+0000,5
1620,3354958501,행사해서 싸게 받아보았습니다,2022-01-26T03:05:02.441+0000,5
1621,3352915326,총알배송 쿠팡이 필요없네요잘 먹겠습니다,2022-01-23T03:45:08.158+0000,5
1622,3339416932,항상 먹고 있습니다 감사합니다,2022-01-05T04:15:14.479+0000,5
1623,3356089501,소화 잘 되고 맛있어요,2022-01-27T12:06:04.752+0000,5
1624,3356088631,맛있고 장에 좋아 구매,2022-01-27T12:04:53.794+0000,4
1625,3353039665,자주시켜먹을게요 싸고 좋네요,2022-01-23T07:38:55.241+0000,5
1626,3351001282,선물 했어요 지인이 좋아합니다,2022-01-20T10:16:21.326+0000,3
1627,3336362607,빠른배송 좋은제품 잘먹겠습니다,2021-12-31T07:15:06.736+0000,5
1628,3354677659,배송 포장 제품 다 맘에 들어요,2022-01-25T13:34:00.966+0000,5
1629,3339905228,상품 잘 받았습니다 감사합니다,2022-01-05T13:31:53.174+0000,5
1630,3354560743,늘 꾸준하게 챙겨먹고 있습니다,2022-01-25T11:35:32.767+0000,4
1631,3355072806,박스줘서 선물하기 좋네요,2022-01-26T06:03:13.933+0000,5
1632,3351123310,우리집유산균은 이거로 정했슷니다 계속 재구매합니다  감사합니다,2022-01-20T12:41:23.723+0000,5
1633,3349504361,유산균 필수죠 아이용과 같이주문해봤어요,2022-01-18T12:13:24.026+0000,5
1634,3355108559,좋아요 항상 먹는 제품입니다,2022-01-26T06:52:59.524+0000,5
1635,3355108280,좋아요 항상 먹는 제품입느다,2022-01-26T06:52:37.105+0000,5
1636,3355920994,먹기 편리하고 좋아요,2022-01-27T08:08:25.049+0000,5
1637,3355290141,좋아요 장이좋아지는게느껴져요,2022-01-26T10:49:04.601+0000,5
1638,3340025766,배송이 너무빨라 가장 놀람,2022-01-05T18:37:37.371+0000,5
1639,3355184053,개별포장되어 먹기 편합니다,2022-01-26T08:31:56.862+0000,4
1640,3348774975,간편하게 먹을 수 있어서 좋습니다  효과는 아직 크게 못보았지만 꾸준히 먹으면 좋아지겠죠,2022-01-17T12:33:42.456+0000,5
1641,3343240386,빠른배송주문 후 뒷날하루만에 도착했어요 그리고 다른 사이트보다 싸게 구매했어요 먹기도 좋고 두번째 구매입니다,2022-01-10T04:44:16.333+0000,5
1642,3339608541,빠르고 안전하게 잘 왔습니다,2022-01-05T08:09:18.370+0000,5
1643,3334261409,늘 챙겨먹는 유산균입니다 장 건강에 최고에요,2021-12-28T12:59:22.560+0000,5
1644,3354577991,선생님 설 선물로 구매했습니다,2022-01-25T11:52:58.231+0000,5
1645,3358319312,만족합니다,2022-02-02T06:20:26.074+0000,5
1646,3354834749,항상먹던것이라재구매함,2022-01-25T23:26:52.290+0000,4
1647,3340147490,유명한제품이라 처음 구매했는데 배송 빠르게 잘 도착했습니다 친환경 트렌드에 발맞춰 내부 비닐이중포장은 없어도 좋지않을까 싶습니다 잘받았습니다,2022-01-06T01:26:11.704+0000,5
1648,3354419319,잘받아 먹고 있어요 감사합니다,2022-01-25T08:45:49.675+0000,5
1649,3338921813,늘 먹던 제품입니다 굿굿,2022-01-04T11:12:54.236+0000,5
1650,3357044293,잘 먹고 있습니다,2022-01-29T04:20:06.214+0000,5
1651,3353470117,만족합니다늘 먹어요,2022-01-24T01:54:02.837+0000,4
1652,3345789831,매번 구입해서 잘먹구 있어요 배송도 엄청 빠르게 와서 정말 만족합니다,2022-01-13T09:03:01.018+0000,5
1653,3356090468,소화 잘 되고 좋아요,2022-01-27T12:07:17.746+0000,5
1654,3352405868,선물돌리기에는 이만한게 없어요 tv광고도 나오고,2022-01-22T07:34:40.710+0000,5
1655,3355365572,가성비 좋은 제품 입니다,2022-01-26T12:15:25.635+0000,4
1656,3336818288,배송도 빠르고 포인트적립도 많아서 좋습니다 재구매할 듯,2022-01-01T03:31:28.813+0000,5
1657,3356762446,잘먹고있어요 맛있어요,2022-01-28T12:36:27.558+0000,5
1658,3350141526,배송이 빨라서 좋아요 가격두 저렴하고요,2022-01-19T08:57:29.892+0000,4
1659,3354334784,처음 먹어보는데 기대중입니당,2022-01-25T06:53:59.996+0000,4
1660,3352460448,복용한지 몇일 안됬지만 괜찮은거 같아요 잘 먹을게요 ,2022-01-22T08:58:05.830+0000,5
1661,3355092500,매번먹는유산균입니다,2022-01-26T06:30:49.827+0000,5
1662,3334177992,먹기 편하고 맛있어요 효과를 기대해봅니다,2021-12-28T11:35:51.488+0000,5
1663,3349744582,항상 주문하는 거예요  저랑 잘맞아요,2022-01-18T23:31:13.879+0000,5
1664,3354055179,간편하게 먹을 수 있어서 좋아요,2022-01-25T00:21:07.848+0000,5
1665,3352171453,빠른배송감사합니다 수고하세요 고맙습니다,2022-01-22T02:04:15.104+0000,5
1666,3348502885,항상 즐겨먹는 유산균입니다 정말 맛도 영양도 좋아요,2022-01-17T04:55:59.675+0000,5
1667,3335410670,믿고 자주 구매해요 행사해서 더 좋아요,2021-12-30T03:18:33.226+0000,5
1668,3328819605,맛도있고 먹기편해서 너무 좋아요 아침에 일어나면 제일먼저 먹고 물한잔마시면 신호가 오네요,2021-12-21T01:39:39.294+0000,5
1669,3355846201,배송 빠르고 좋습니다,2022-01-27T06:27:50.583+0000,5
1670,3340844498,항상 먹는 제품이에요,2022-01-06T16:02:26.253+0000,5
1671,3348120189,년째먹고있어요 너무좋아요 온가족이 먹을수있어 좋아요,2022-01-16T13:24:45.441+0000,5
1672,3353629407,안먹다가 꾸준히 먹으니 좋네요,2022-01-24T05:18:55.811+0000,5
1673,3352869515,설날 선물용으로 구입했는데 좋아요,2022-01-23T02:35:05.188+0000,5
1674,3329553345,배송도 빠르고 포장도 꼼꼼 합니다 유산균은 여기서만 먹는데 유통기한도 내년 월까지네요 잘먹을게요,2021-12-21T22:07:57.769+0000,5
1675,3350843174,확실히 먹으니까 화장실 못가는 날이 없어진 것 같아요,2022-01-20T06:51:44.775+0000,5
1676,3356156955,저렴하게 잘 샀어요,2022-01-27T13:35:16.191+0000,5
1677,3341203343,상품 잘 받았습니다,2022-01-07T05:07:54.350+0000,5
1678,3354641425,배송도 빠르게오고 좋아요,2022-01-25T12:56:38.943+0000,5
1679,3354634209,설선물하려고 구입했어요,2022-01-25T12:49:33.149+0000,5
1680,3355177654,저렴하게 구매하였습니다 ,2022-01-26T08:23:49.145+0000,5
1681,3353630186,우리가족 늘이제품만먹어요,2022-01-24T05:20:10.821+0000,5
1682,3350289324,항상 믿고 먹는 종근당 락토핏 이번에도 대장 건강 부탁해여,2022-01-19T11:50:23.498+0000,5
1683,3349473067,생유산균을 늘 구매해서 먹고 있는데 장건강에 좋은거 같애요,2022-01-18T11:43:15.038+0000,4
1684,3355854208,매번 이거만 먹어용 굿굿,2022-01-27T06:38:45.230+0000,5
1685,3354379498,저렴한 가격에 잘 샀어요,2022-01-25T07:54:48.871+0000,5
1686,3352861694,처음 주문한건데 효과있음좋겠네요,2022-01-23T02:25:23.787+0000,4
1687,3356318760,잘 먹어보겠습니다 ,2022-01-28T00:43:02.832+0000,5
1688,3346254548,꾸준히 먹고 있는데 락토핏이 제일 좋은거 같아요  선물하기도 좋네요,2022-01-14T01:43:55.242+0000,5
1689,3353901165,라방에서 하길래 처음 주문했는데 괜찮넹,2022-01-24T12:57:36.932+0000,4
1690,3355242819,배송이 엄청 빨라요,2022-01-26T09:49:56.842+0000,5
1691,3355383908,배송 빠르고 좋네요,2022-01-26T12:36:07.625+0000,5
1692,3352942415,조아요조아어오어아앙,2022-01-23T04:32:42.971+0000,5
1693,3355037672,아이들도 잘 먹고 좋아요,2022-01-26T05:12:21.756+0000,5
1694,3345346985,역시 락토핏  매일 아침마다 공복에 먹고 있는데 효과 좋은것 같습니다,2022-01-12T23:08:24.111+0000,5
1695,3354786605,선물 주고받기 딱 좋아요,2022-01-25T17:08:35.983+0000,5
1696,3338025060,저렴하게 샀고 배송도 빠르네요,2022-01-03T06:30:22.000+0000,5
1697,3339701676,빠른 배송 감사합니다,2022-01-05T09:59:29.085+0000,5
1698,3338760915,좋은 유산균 싸게 잘 샀습니다,2022-01-04T08:20:27.675+0000,5
1699,3334278376,배송 진짜 너무 빠르네요 좋아요 싸게 잘 샀어요 잘 먹을게요,2021-12-28T13:17:00.560+0000,5
1700,3332978796,아이가 젤 잘 먹네요 가격이 저렴해서 부담 없어요,2021-12-27T01:06:29.420+0000,5
1701,3354228333,늘 이용하는 제품입니다,2022-01-25T04:18:18.391+0000,5
1702,3351051555,온가족이  잘 챙겨먹고 있습니다  다 같이  먹고 건강해지기를,2022-01-20T11:17:58.145+0000,4
1703,3353732356,늘 먹고있는 제품으로 좋아요,2022-01-24T08:07:48.486+0000,5
1704,3343792306,변비때문에 주문했는데 먹고나니 훨씬 수훨한거 같아요매우만족합니다 재구매 할께요,2022-01-11T02:30:01.382+0000,5
1705,3352053973,아들이조와해서계속시켜먹구있어요,2022-01-21T20:12:39.113+0000,4
1706,3355981929,배송빨루고 포장도 꼼꼼여,2022-01-27T09:36:35.774+0000,5
1707,3350377808,매일 먹는건데 포장이랑 꼼꼼히 잘 와서 마음에 듭니다,2022-01-19T13:25:33.497+0000,5
1708,3352850007,늘 먹던거라 다먹어서 주문했습니당,2022-01-23T02:11:55.017+0000,5
1709,3340522173,문제없이 잘왔어요,2022-01-06T08:57:06.777+0000,5
1710,3332489944,먹던거라 주문해요 맛도 괜찮고 편리합니다 좋아요,2021-12-26T03:15:54.654+0000,5
1711,3349944388,재구매 합니다 조아요 온가족 먹기에 편해요,2022-01-19T04:53:03.375+0000,5
1712,3345232868,아이 먹이고 있는데 변보는게 훨 수월해졌어요 배송이 빠르다는게 진짜 좋네요,2022-01-12T14:14:58.077+0000,5
1713,3337024079,꾸준히 먹으면 효과좋아요 가성비 매우좋아 강추,2022-01-01T11:09:22.074+0000,5
1714,3328085206,먹다보면 끊을 수 없네요 거의 다 먹어가서 또 구매해야지 하다가 생각나서 리뷰 올려봅니다,2021-12-20T00:56:44.687+0000,5
1715,3352554438,새콤달콤해서 비타민같은 맛입니다,2022-01-22T11:27:21.172+0000,3
1716,3353471433,늘 챙겨먹는유산균 좋아요,2022-01-24T01:55:18.859+0000,5
1717,3347086822,항상먹던 제품이라 망설임없이 구매했습니다 배송도 빠르고 포장도 잘되어 와서 만족합니다,2022-01-15T02:47:33.109+0000,5
1718,3351525795,평소에 먹던거 다 떨어져서 재주문 했어요,2022-01-21T03:50:36.371+0000,5
1719,3354574928,온가족이 잘먹고 있어요 ,2022-01-25T11:49:55.245+0000,4
1720,3352616508,리뉴얼되면서 단맛이 줄어서 좋네여,2022-01-22T13:00:33.796+0000,4
1721,3353171789,늘 믿고 먹는 유산균 맛도 먹기도 편함,2022-01-23T11:43:52.355+0000,5
1722,3343059439,선물용으로 급히 필요했는데 빠른 배송 감사합니다 유통기한도 년 가량이라 넉넉해요,2022-01-10T01:10:46.257+0000,5
1723,3352045805,매번 잘 먹고 있어서 선물로 구입했어요,2022-01-21T18:05:33.755+0000,5
1724,3353854032,명절선물로 손색없어요,2022-01-24T11:43:33.269+0000,5
1725,3330410839,아주 만족요 가격도굿 선물상자도 이쁘구요 유통기한도  길고 좋네요 맛은 말뭐임,2021-12-23T00:36:26.153+0000,5
1726,3333344649,가성비 최고의 유산균  재주문해서 먹는중,2021-12-27T08:45:03.928+0000,5
1727,3358726284,좋아요,2022-02-03T05:32:50.716+0000,4
1728,3340681255,배송빠르고 좋아요,2022-01-06T12:07:07.500+0000,5
1729,3348386820,유통기한도 좋고 배송도 빠르고 무엇보다 저렴하게 잘  사서 맘에 들어요,2022-01-17T02:31:17.962+0000,5
1730,3351818717,빠른 배송과 합리적인 가격 다 좋아요,2022-01-21T10:23:55.645+0000,5
1731,3351495144,남편이 좋아해요 잘먹을께요,2022-01-21T03:14:10.700+0000,4
1732,3353202363,생각보다 너무 맛있어서 놀랬네요 ,2022-01-23T12:30:22.922+0000,5
1733,3355744232,늘 먹는 제품이에요,2022-01-27T03:59:07.819+0000,5
1734,3351130211,재구매했어요 좋은거같아요,2022-01-20T12:49:16.784+0000,5
1735,3352533499,이거 먹고 소화도 잘되고 좋네요,2022-01-22T10:56:43.077+0000,5
1736,3343551482,항상 먹던거라 만족스럽게 먹고 있는데 이번건 갈짝 비릿한 맛이 나는데 이건 개인차라 일단 배송은 완전 빨리왔고 제품도 만족합니다,2022-01-10T13:32:27.952+0000,5
1737,3350573942,먹기넘넘편해서좋아요부담없어요,2022-01-20T00:38:15.694+0000,5
1738,3354829908,배송빠르고 좋아요,2022-01-25T23:12:42.364+0000,5
1739,3353472150,배송도 빠르고 저렴하네요,2022-01-24T01:56:02.494+0000,5
1740,3338250721,배송빨라요 쓸만합니다,2022-01-03T12:22:59.982+0000,4
1741,3338588820,잘받았습니다 감사합니다,2022-01-04T04:37:07.814+0000,3
1742,3335605722,선물 드렸더니 좋아하세요 배송 빠르고 좋습니다,2021-12-30T07:41:45.928+0000,5
1743,3338174574,배송이 빨라서 정말 좋아요,2022-01-03T10:33:33.398+0000,5
1744,3353961331,먹기편하고 좋습니다,2022-01-24T14:43:06.507+0000,5
1745,3342484055,장을위해 먹어보려구요 타제품먹다 갈아타봤어요 이틀만에 가격내려 기분상해서 점 아웃,2022-01-09T02:06:21.664+0000,4
1746,3333172553,늘챙겨먹는 락토핏 좋아요 배송도빨라요,2021-12-27T04:44:17.096+0000,5
1747,3348168321,친정엄마가 쿠준히 드시고 배변활동이 좋아지셨어요 강추합니다,2022-01-16T14:49:23.598+0000,5
1748,3351492600,배송 빠르고 기한도 넉넉하고 가격도 착하네요,2022-01-21T03:11:22.529+0000,5
1749,3354013071,배송이 빨라서 좋아요,2022-01-24T20:12:48.729+0000,5
1750,3352686600,선물용이에요 잘받았습니다,2022-01-22T15:01:09.854+0000,5
1751,3354310372,항상 애용 하고 있습니다,2022-01-25T06:19:47.931+0000,5
1752,3336474889,좋아요 선물 용으로 만족 합니다 ,2021-12-31T10:19:10.968+0000,5
1753,3334232084,아버님이 드시고 좋다하여 구매합니다 저렴하게잘 구매했어요,2021-12-28T12:30:08.527+0000,5
1754,3352365611,늘 먹던거입니다 잘먹을게요,2022-01-22T06:33:06.120+0000,5
1755,3337720410,확실히 좋은거같아요옹,2022-01-02T23:10:56.103+0000,5
1756,3333442683,믿고 먹는 락토핏  습관이에요 이제,2021-12-27T11:12:07.751+0000,5
1757,3350540928,배송도 빠르고 일단 락토핏은 맛이 엄지척,2022-01-19T23:41:48.249+0000,5
1758,3355755469,배송빠르고 좋아욤,2022-01-27T04:16:17.471+0000,5
1759,3326015024,쿠폰할인으로 저렴하게 구입한것 같아요,2021-12-16T23:56:04.434+0000,5
1760,3351729626,선물하기에 참 좋게 포장됐네요,2022-01-21T08:15:29.894+0000,5
1761,3352665942,좋은가격에 구매 했습니다,2022-01-22T14:20:21.469+0000,4
1762,3351467895,늘  먹던거 명절  선물로  구입했어요,2022-01-21T02:46:02.695+0000,5
1763,3352351446,항상 먹던거예요 앞으로도 계속,2022-01-22T06:11:52.370+0000,5
1764,3346994914,늘 잘먹고 있는 유산균입니다유산균어뵤인 안되죠,2022-01-15T01:01:44.433+0000,5
1765,3335009541,배송이 굳 오전 시에 발송해서 시에 배송 시작해서 시에 도착 ,2021-12-29T12:10:54.769+0000,5
1766,3349853534,배송정말 빨리 왔어요급하게 필요했는데 넘좋아요,2022-01-19T02:38:46.725+0000,5
1767,3347161525,온 가족 먹을라고 주문했어요감사합니다,2022-01-15T04:26:25.370+0000,5
1768,3353357530,배송 빠르고 좋아요,2022-01-23T22:51:39.207+0000,5
1769,3351943189,유산균은 이거밖에 안먹어요,2022-01-21T13:19:41.192+0000,5
1770,3368423906,좋아요좋아요좋아요좋아요,2022-02-15T17:51:18.443+0000,5
1771,3329212448,배달속도 빠르고 좋습니다  유산균도 마음에드네요,2021-12-21T10:14:39.096+0000,5
1772,3337360294,밤에 주문했는데 다음날 배송이 되어 너무 놀랬어요 가루형태를 잘 못 먹는데 랏토핏유산균은 거북하지않고 맛있어서 좋아요이제 랏토핏으로 정착해야겠어요,2022-01-02T05:08:58.009+0000,5
1773,3336452417,매번 먹는 유산균 행사해서 잘삿어요,2021-12-31T09:37:18.595+0000,4
1774,3350569126,가성비좋고먹기편하고맛도좋아요,2022-01-20T00:32:11.693+0000,5
1775,3338094896,배송 아주빨랐구요 늘 믿고 먹어요,2022-01-03T08:17:20.812+0000,5
1776,3344512326,항상 애용하고있습니다 장관리에 도움이 되는것 같아요,2022-01-11T22:05:40.479+0000,5
1777,3348627217,빠른 배송 깔끔한 포장 감사합니다 잘 복용하겠습니다,2022-01-17T08:13:10.865+0000,5
1778,3351012766,배송 빠르고 행사해서 저렴하게 샀네요,2022-01-20T10:30:47.112+0000,5
1779,3353795926,빠른배송 감사합니다 ,2022-01-24T10:06:25.862+0000,5
1780,3331944023,좋아요 맛나고 건강에 확실히 도움됩니다,2021-12-25T02:41:43.517+0000,5
1781,3337097966,꾸준히 맛있게 잘 먹고 있습니다,2022-01-01T13:44:51.023+0000,5
1782,3352208447,꾸준하게 잘 먹고 있습니다,2022-01-22T02:44:44.833+0000,3
1783,3352170360,잘 받았습니다 감사합니다,2022-01-22T02:03:03.581+0000,5
1784,3353706239,항상 먹는 제품이에요,2022-01-24T07:23:16.021+0000,5
1785,3350296376,가격도 좋고 일단 믿음이가는 브랜드입니다,2022-01-19T11:57:51.169+0000,5
1786,3335840987,항상 떨어지지 않게 사서 먹고 있습니다,2021-12-30T12:56:24.122+0000,5
1787,3352333911,포장  먹기  편하고  조아요,2022-01-22T05:45:43.985+0000,5
1788,3351002053,항상 시키던 거라 엄마 사드렸어요,2022-01-20T10:17:21.745+0000,5
1789,3348831484,엄마가 좋아하세요 맛도 있어서 자주 먹게됩니다,2022-01-17T14:06:28.781+0000,5
1790,3352379441,배송빠릅니다 감사합니다,2022-01-22T06:54:07.231+0000,5
1791,3347792906,부모님 사드렸는데 빼송도 빠르고 제품 효과 좋다고 하시네요,2022-01-16T03:31:09.944+0000,5
