,id,reviewContent,createDate,reviewScore
2945,3265435299,먹기 편해서 부모님께서 좋아하세요 간식 느낌이라 매일 빠짐없이 챙겨드시기도 좋구용 다만 통 안에 개씩 비닐포장이 또 따로 되어있는데 두번 뜯어야하고 별로 좋지 않은 거 같아요 그냥 통안에 개별스틱이 들어있는게 좋을 것 같습니다,2021-09-20T13:46:10.353+0000,5
2946,3297740178,부모님이 아주 좋아하십니다,2021-11-07T03:38:48.553+0000,5
2947,3268305577,항상 챙겨먹는거라 저도 사고 저희 시어머니도 친정엄마도 챙겨드렸어요 너무 좋아하십니다 추석이라 저렴하게 구매했네요 잘먹겠습니다  앞으로도 다른제품도 저렴하게 판매해주세요,2021-09-26T11:07:04.021+0000,5
2948,3269694964,포장 꼼꼼하게 왔고 먹기도 편해요 아침 공복에 한포씩 먹는데 좋아요 다만 기분탓인지 향이 짙어진거같은데 사실 향 없었으면 좋겠어요,2021-09-28T07:57:30.470+0000,5
2949,3298963542,가격도 제품도 모두 만족합니다,2021-11-09T03:35:43.259+0000,5
2950,3274168277,항상 먹던 제품이고 저렴하게 구매한것같아서 만족해요 다먹으면 또 주문할게요,2021-10-04T13:09:52.845+0000,5
2951,3299957829,열심히 먹어볼게요,2021-11-10T08:32:32.112+0000,5
2952,3296223540,배송도 빠르고 아주 저렴히 잘샀어요,2021-11-04T16:47:51.499+0000,5
2953,3269959207,한동안 안 먹다가 변비때문에 다시 먹기시작했는데 확실히 효과가 있는건지 화장실 가는 일이 수월해졌네요 꾸준히 챙겨먹어야겠어요,2021-09-28T12:42:35.601+0000,5
2954,3268639496,종근당건강 락토핏 생유산균 애용하고 있어요 라이브 방송에서 저렴하게 샀어요 만족해요,2021-09-27T02:16:37.565+0000,5
2955,3295765061,물 먹던제품이에요 배송 빠르고 좋았어요,2021-11-04T05:25:55.726+0000,4
2956,3293060193,매일먹는 유산균인데 파리바게트 쿠폰도 받아서 잘 사용했습니다,2021-10-31T07:17:24.177+0000,5
2957,3282269542,꾸준히 한달동안 먹고 있어요 맛있어요,2021-10-16T03:51:54.920+0000,5
2958,3282384027,딸이먹고싶다고해서구매했어요,2021-10-16T06:14:56.147+0000,5
2959,3260850124,우선 엄청 저렴하게 구매하게 되서 좋아요 빠른 배송은 두번째로 감사하구요 기프트박스에 왔는데 이건 저 자신에 대한 추석 선물이네요  기존에 한통 선물 받아서 먹고 있었는데 가성비가 좋은것 같아 구매하게 됐어요 남편이랑 같이 먹으려구요 감사합니다,2021-09-12T14:54:53.143+0000,5
2960,3295546893,먹기도 편하고 좋아서 재구매할거예요,2021-11-04T00:04:43.976+0000,5
2961,3262191968,배송 빠르게 잘 받았습니다  당첨사은품은 한달후에나 보내준데요 락토핏생 유산균은 전국민의 유산균  명불허전 이것먹고 화장실 가는걱정줄어 뭐든 먹는거에 걱정없어요계속 판매해 주세요 더욱 건강해질께요 감사합니다,2021-09-14T12:41:35.841+0000,5
2962,3288751960,하루에 한포로 맛도 맛있어서 아이들이 잘 먹어요 변비 개선효과는 잘 모르겠네요,2021-10-25T04:26:40.325+0000,5
2963,3294229674,매일먹는 온가족용 유산균으로 가성비 최고예요,2021-11-02T05:28:12.825+0000,5
2964,3282892933,잘먹고있습니다 많이파세요,2021-10-17T01:34:11.604+0000,5
2965,3266162250,이상품 먹다가 잠깐 다른 상품으로 변경했는디 아이가 거부감이 심해 다시 락토핏으로 돌아왔네요 유산균 중 맛은 제일 좋은것 같아요,2021-09-23T03:21:34.288+0000,5
2966,3294908012,울집은 이거로 통일 온가족이 먹어요 맛도 좋아요,2021-11-03T03:13:14.835+0000,5
2967,3274998849,매번 먹는거에요 살딸래미도 같이 먹는데 다른것보다 맛있다고 해요,2021-10-05T23:51:59.032+0000,5
2968,3297850803,늘 먹던 제품입니다 좋아요,2021-11-07T07:40:17.955+0000,5
2969,3283277688,꾸준히 먹는 제품이에요,2021-10-17T12:14:59.551+0000,5
2970,3287312611,아주 좋아요 ,2021-10-22T22:53:21.155+0000,5
2971,3276245074,매일 먹고있어요 이제 한통밖에 안남았네요 쟁기러 갑니다,2021-10-07T10:09:21.787+0000,5
2972,3298600145,두번째주문요많이파세요,2021-11-08T10:40:00.499+0000,5
2973,3283513281,항상 잘 먹구 있습니다 굿,2021-10-18T01:07:15.206+0000,4
2974,3290066270,항상 먹는 제품이에요 저렴하게 행사 때 구매해서 좋아요,2021-10-27T01:29:49.187+0000,5
2975,3278353337,유통기한이 넉넉해서 가끔 먹는거 잊어버려도 문제없네여,2021-10-11T00:50:37.403+0000,5
2976,3280974781,매번 먹는 나의유산균  짱짱입니다,2021-10-14T11:55:56.425+0000,5
2977,3282983887,먹기 간편하고 잘 녹아요,2021-10-17T03:24:29.595+0000,5
2978,3281032930,잘 먹고 있어서 방금 재주문했습니다,2021-10-14T12:55:52.876+0000,5
2979,3281121225,늘 먹는거라서 믿고 주문했어요,2021-10-14T14:35:28.260+0000,5
2980,3264492999,배송도 빠르게 온편이고 선물용으로 산거라 걱정했어요 혹시나 구겨져서 오진않을까 포장상태가걱정되었는대 정말 꼼꼼하고 깔끔하게 도착했습니다 락토핏 맛있고 성분도 좋아서 년째 복용하고 있는품이예요 항상 다른곳에서 구입했는데 이번에 엄청 저렴하게 잘샀습니다  앞으로 라이브방송 자주해주세요 ,2021-09-18T02:07:04.775+0000,5
2981,3282843502,매일 잘먹고 있습니다,2021-10-17T00:03:55.619+0000,5
2982,3281210616,좋은 제품 좋은 가격에 잘 산거 같아요,2021-10-14T21:48:41.018+0000,5
2983,3296399358,온가족이 먹어도 무난해요,2021-11-05T02:17:14.205+0000,5
2984,3283138708,먹기 편하고 좋아요,2021-10-17T08:00:18.130+0000,4
2985,3262788034,라이브 방송 기다리다 구매 했습니다 늘 먹던거라 고민 없이 구매 했습니다  추석 연휴 때문인지 조금 늦게 오긴 했지만 괜찮습니다  다먹으면 다음에도 주문 예정입니다 너무 좋네요  락토핏 강추합니다,2021-09-15T10:04:42.761+0000,5
2986,3283984192,꾸준히  잘먹고 있습니다,2021-10-18T11:56:36.181+0000,5
2987,3276462780,유산균은 생활 필수품입니당 저렴한 가격에 좋은 기회 잘 샀습니다 감사해요,2021-10-07T14:12:19.509+0000,5
2988,3294983244,엄마 선물로 사드렸는데 좋아하시네요,2021-11-03T05:11:29.072+0000,5
2989,3274930984,매일 아침마다 먹는 유산균  먹기편하고 맛있어서 좋아요,2021-10-05T15:37:56.565+0000,5
2990,3282493940,좋아요 늘 재구매합니다,2021-10-16T08:36:50.793+0000,5
2991,3268045567,다른 제품 먹다가 지인이 추천해서 구매했어요 맛도 괜찮고 행사로 저렴히 구매해서 더 만족스러워요노란 상자도 예뻐서 식탁 한켠에 놓아도 좋네요,2021-09-26T02:12:26.855+0000,5
2992,3290048053,맛도 좋고 먹기도 간편하고 가족들 장건간 관리에 좋아서 계속 주문해서 먹고있습니다,2021-10-27T01:03:00.052+0000,5
2993,3296696851,매번 잘 시켜먹습니도,2021-11-05T08:52:49.052+0000,5
2994,3293392948,항상   이용하는거라 가격면에 만족하고 이용합니다,2021-11-01T00:13:19.081+0000,5
2995,3267501178,시부모님 사드렸어요 얼마전 사드리고 다드시면 또 사드린다고 날짜 체크해놨는데 달에드실꺼 달에 다드셨네요 입이 심심하면먹고 눈에 보이면먹고 유산균이 과자는 아닌데,2021-09-25T06:14:22.738+0000,5
2996,3264162146,그동안 골드만 먹다가 이번에 콜라겐 함유된 뷰티도 같이 주문해봤어요 피부에 효과가 있을지는 꾸준히 먹어봐야 알 것 같아요 골드는 하루에 포인데 뷰티는 하루에 포 먹어야 되네용,2021-09-17T08:45:56.699+0000,5
2997,3266238513,구매후 매일 꾸준히 챙겨먹은 결과 화장실 하루에 한번씩 무조건 갑니당 재구매 해야겠어요,2021-09-23T05:46:46.476+0000,5
2998,3295962287,상품 배송 모두 마음에 듭니다,2021-11-04T09:54:49.662+0000,5
2999,3263334562,친정 부모님께서 매일 드시는제품이라 행사하면 바로 구매합니다 익숙한 제품이라 다른건 별로 안 맞으신지 요 제품을 계속 사달라하시네요 배송빠르고 행사가격으로 저렴하게 구매해서 좋아요,2021-09-16T05:33:35.826+0000,3
3000,3293683064,먹던거라 인터넷으로 싸게 구매했네요,2021-11-01T06:59:33.090+0000,5
3001,3296257183,네 늘 구입하고 있습니다,2021-11-04T22:29:11.689+0000,5
3002,3292746614,배속이 편안합니다 효과 좋은 사람한테는 정말 굿,2021-10-30T14:30:35.293+0000,5
3003,3292279269,선물용으로 샀는데 배송도 빠르고 포장도 구겨짐없이 좋아요,2021-10-30T01:27:32.472+0000,5
3004,3293076515,늘 먹은 유산균입니다  재구매해서 먹겠습니다,2021-10-31T07:54:27.838+0000,5
3005,3276272947,싸게 잘샀어요 항상 가족들이 락토핏 먹어요,2021-10-07T10:40:32.885+0000,5
3006,3293176349,장 건강을 위해 온가족이 함께 먹고 있어요,2021-10-31T11:27:24.913+0000,5
3007,3296217671,항상 먹는 제품이에요,2021-11-04T16:20:05.033+0000,4
3008,3281320615,꾸준히 잘 먹고 있어요,2021-10-15T01:21:31.351+0000,5
3009,3289860961,다른유산균갔다가  결국 돌아왔어요최고임,2021-10-26T13:54:24.340+0000,5
3010,3281839013,저렴한 가격에 구매해서 좋았습니다 다른분 리뷰사진보다 유통기한 임박한거 보내주셔서그분들 보다 늦게시켰는데 그거빼곤 다좋아요,2021-10-15T11:44:13.032+0000,5
3011,3282158891,장건강에 효과있네요,2021-10-16T01:54:38.090+0000,5
3012,3277676811,원래먹던것보다 더 효과가 좋은것 같아요 꾸준히먹겠음,2021-10-09T10:07:31.140+0000,5
3013,3277824920,늘 먹던 락토핏 변비가 심해 하루에 두개씩 먹어요,2021-10-09T17:05:45.415+0000,5
3014,3261267479,온가족이 다함께 항상 먹던 거라 주문했어요   다른 프로바이오틱스 먹어봤지만 종근당 제품이 제일 좋은 것 같아요 이번에 가격도 좋고 리뉴얼되어서 더 기대되네요   빠른 배송 잘 받았습니다,2021-09-13T06:57:50.501+0000,5
3015,3283582111,부모님 드리려고 구입했는데 맛도 있고 드시기도 편하다고 하시네요 좋은 가격에 구입해서 좋았구요 재구매 예정입니다,2021-10-18T02:27:58.711+0000,5
3016,3294003266,이벤트에도 당첨 되어서 덤에 덤을 얻었습니다,2021-11-01T23:25:49.571+0000,5
3017,3277183636,엄마 드렸어요 장 튼튼해지시라고,2021-10-08T12:56:49.323+0000,5
3018,3289194243,꾸준히 먹고있어요 건강에 도움됐으면 합니다,2021-10-25T23:23:21.898+0000,5
3019,3263560114,박스포장 깨끗하고 신경써서 보내주셨어요 첨에 락토핏먹다가 다른거 먹어보자싶어 갈아탔다가 저에게는 락토핏이 잘 맞는 걸 깨달아 다시 구매했습니다,2021-09-16T11:09:05.589+0000,5
3020,3263663783,일단 환경을 생각한 패키징이 너무 마음에 들었어요 비닐 뽁뽁이가 아닌 종이 완충제였구요 개월치가 어떻게 포장되어 올까 궁금했는데 개 통을 개 박스에 넣어서 깔끔히 포장해주셨더라구요 선물용으로 딱 좋을 것 같아요 박스 위에 손잡이도 있어서 편리할 것 같아요,2021-09-16T13:29:59.718+0000,5
3021,3292575537,부모님 사드렸는데 목넘김도 좋고 양도 많아서 좋아요,2021-10-30T09:17:32.862+0000,4
3022,3292807844,주변에서 너무 좋다해서 먹기 시작했어요,2021-10-30T20:54:43.855+0000,5
3023,3266372995,이번에 똑 떨어져서 저렴하게 구입했어요 다른 유산균보다 가격이나 제품함량으로도 좋아요 배송은 추석이 있어서 조금 느렸지만 뭐 추석 택배대란이라,2021-09-23T10:02:20.907+0000,5
3024,3263749713,항상 이용하는 제품이라 믿고 구매했네요  가격두 저렴하구 다른 유산균보다 맛두 있어서 항상 이 제품만 이용합니다 배송도 빠르고 제품 하자없이 잘 왔어요  담에 또 구매할깨요 ,2021-09-16T16:47:33.798+0000,5
3025,3266741491,항상 먹는 제품인데 저렴하게 잘 구매했어요 배송도 정말 빨라서 깜짝 놀랬어요,2021-09-24T04:50:42.969+0000,5
3026,3262788619,부모님께 주기적으로 보내드리고있는 제품이예요 이번에도 라이브방송 조건이 좋아서 바로 구매해서 보내드렸어요 이전보다 성분도 더 강화되다니 기대되네요 가족 모두 복용하기 편해서 애용하고있어요 항상 빠르고 정확한 배송도 마음에 들어요,2021-09-15T10:05:32.822+0000,5
3027,3293626718,부모님께 선물드렸는대 좋아하세요 ,2021-11-01T05:25:19.469+0000,5
3028,3273661633,변비있는 아빠한테 추석선물했어요 효과있다고 좋아하시네요,2021-10-03T15:19:29.559+0000,5
3029,3266779240,유산균들 가격 차이가 있는데 락토핏은 저렴한 편이네요 너무 맛있어서 한 봉의 양이 아쉬워요 중독성 있는 맛 때문에 또 구매하게 되네요,2021-09-24T05:51:21.042+0000,4
3030,3295914202,항상 잘먹고있습니다,2021-11-04T08:46:04.218+0000,5
3031,3293832788,먹기는 정말 편한데 효과는 좀 잘 모르겠네요,2021-11-01T11:49:16.703+0000,4
3032,3294995610,꾸준히 먹는 유산균이예요,2021-11-03T05:29:44.087+0000,5
3033,3281608909,매일 챙겨 먹고잇어요 ,2021-10-15T06:59:37.171+0000,5
3034,3277594797,매번사먹는제품이에요 유통기한넉넉하네용,2021-10-09T06:46:13.100+0000,5
3035,3293047199,맛이 좋아 매일 빼먹지않고 먹게됩니다,2021-10-31T06:49:10.373+0000,5
3036,3295179461,배송도 빠르고 좋아요,2021-11-03T09:30:43.917+0000,5
3037,3282480029,맛도 좋고 효과도 좋아요,2021-10-16T08:17:57.294+0000,5
3038,3279445713,추석 선물용으로 구입했어요,2021-10-12T14:08:33.543+0000,4
3039,3279445332,추석 선물용으로 구입했어요,2021-10-12T14:07:58.726+0000,4
3040,3277506840,먹기도 편하고 좋아서 계속 이용하고 있습니다,2021-10-09T03:53:22.145+0000,5
3041,3281155680,먹기도 편리하구 맛도 좋아요,2021-10-14T15:33:26.785+0000,5
3042,3279775719,좋아요 항상 먹는거라 시켰어요,2021-10-13T05:18:07.717+0000,5
3043,3294807866,배송이 빨라서 좋아요,2021-11-03T00:32:44.880+0000,5
3044,3262174074,부모님 추석 선물드리려고 주문했어요 그동안 꾸준히 락토핏 드셔왔는데 최근에 저렴하게 나와서 구매했어요  유산균은 꾸준히 먹어야 좋다고 하니까 꾸준히 먹고 건강하셨으면 합니다  감사합니다,2021-09-14T12:21:32.150+0000,5
3045,3292252746,꾸준이 섭취했더니 장이 건강해지는 느낌이드네요,2021-10-30T00:47:20.194+0000,5
3046,3270676859,리뉴얼됐다더니 맛이살짝 달라진것 같기도해요 무난해서 늘 이것만 사먹어요,2021-09-29T10:51:06.728+0000,5
3047,3295215955,먹기도 편하고 효과도 좋아요,2021-11-03T10:17:33.110+0000,5
3048,3289371755,년째 섭취중인데 장이 튼튼해진듯하다장트러블이 있었는데 이걸 섭취한후에는 없다,2021-10-26T04:05:49.914+0000,5
3049,3294689324,꾸준히 복용 중입니다,2021-11-02T15:07:05.184+0000,5
3050,3278742176,잘먹고있는데 쿠폰은언제주나요,2021-10-11T13:11:43.423+0000,5
3051,3273048172,맛도 좋고 변비도 사라지네요 장건강을 위해서 꾸준히 먹으려구요,2021-10-02T12:42:34.765+0000,5
3052,3295911414,좋아요 좋아요 너무좋아요,2021-11-04T08:42:13.355+0000,5
3053,3294911455,매일 잘먹고 있습니다,2021-11-03T03:19:18.617+0000,5
3054,3275592451,좋아요속이 약간 더 편해진 느낌,2021-10-06T13:12:21.709+0000,5
3055,3278430282,유산균 필요했는데 딱 좋아요,2021-10-11T02:53:56.443+0000,5
3056,3266666305,선물해서 제품은 없는데 저도 이걸로 선물받았네요  주변지인 친인척들 저희집도 항상 챙겨 먹는 락토핏이에요 잘먹을께요 감사해요,2021-09-24T02:27:05.299+0000,5
3057,3264950847,늘 즐겨먹는 유산균 락토핏맛도좋고 성분도좋고 가성비도 넘 좋아요온가족 모두 잊지않고 하루한번 꼭 챙겨먹고있어요,2021-09-19T02:57:34.042+0000,5
3058,3281203317,추석때라 양가부모님꺼 다샀어요쇼핑라이브에서 이벤트당첨됐는데 이벤트당첨된건 안와서 별뺏습니다맛은좋아요 ,2021-10-14T20:45:26.063+0000,3
3059,3280347205,유산균은 락토핏이죠,2021-10-13T18:15:53.473+0000,5
3060,3265949573,비싼거 먹다가 효과 못보고 락토핏으로 갈아탔는데 효과도 보고 가성비까지 좋아서 추석  특가로 구매하고 선물까지 보냈어요 선물포장 박스도 튼튼하고 깔끔하고 좋아요,2021-09-22T12:49:27.892+0000,5
3061,3293613116,재주문 하네용  잘받았습니당,2021-11-01T05:04:05.889+0000,4
3062,3269326622,늘 먹는 유산균이에요 효과가 조금은 있는거같아 이것만 먹어요 저렴히 잘 샀어요,2021-09-28T00:27:39.680+0000,5
3063,3269326340,늘 먹는 유산균이에요 효과가 조금은 있는거같아 이것만 먹어요 저렴히 잘 샀어요,2021-09-28T00:27:10.359+0000,5
3064,3263225286,선물상자 포함 구성되어 있어서 추석선물로 구입했습니다 락토핏을 모르는 분들은 거의 없을테니 받는 분도 더 반가운 제품일 듯 싶구요 드시고 효과가 좋았다는 반응이 오면 다음 설명절에도 락토핏 구매각입니다,2021-09-16T02:33:34.351+0000,5
3065,3293595984,굳굳베리굳굳굳베리굳,2021-11-01T04:38:33.988+0000,5
3066,3288521588,항상 먹는 유산균입니다잘받았습니다,2021-10-24T22:37:56.567+0000,4
3067,3274381721,선물용으로 너무 좋고요 맛도 맛이다고 해요,2021-10-05T02:04:56.124+0000,5
3068,3292923638,맛잇어서애들이잘먹어요,2021-10-31T02:42:49.306+0000,5
3069,3271066037,선물했는데 받는 분이 너무 좋아하셨어요 먹기도 간편하고 맛있어요,2021-09-30T01:34:29.817+0000,5
3070,3261812740,너무 좋고 포장 정말 좋네요 선물세트로도 제격이에요 믿고 먹는 유산균왕 종근당,2021-09-14T04:12:22.213+0000,5
3071,3294838260,매일 매일 꾸준히 먹고 있습니다,2021-11-03T01:23:42.736+0000,5
3072,3263625092,엄마가 먼저 먹어보고 너무 좋다구 추천해줬는데 설마하구선 그냥 마트서 한통 사서 먹었는데 정말 효과봐서 재구매하게 됐네요하루에 기본번은 설사를 해서 너무 힘들었는데 넘 건강해져서 놀랍습니다,2021-09-16T12:35:00.343+0000,5
3073,3262938010,항상먹는 락토핏유산균 행사가에 혜택 많이 받을 수 있는 기회 놓치지않고 구매했어요 맛도좋고 장 예민한 남편도 이것만 찾네요 이제 안먹으면 허전해요 배송도 빠르고 선물용으로 예쁘게 포장되어왔어요,2021-09-15T13:10:04.877+0000,5
3074,3262072573,매일 모닝 락토핏 하고있어요 유산균은 빈속에 먹는게 좋다는 이야기를 들어서 아침마다 먹고 있는데 유산균이 맛있기까지 하네요 이미 사둔게 남아있지만 세일해서 미리 사두었어요 선물용으로 나온거라 선물하기도 좋을 것 같아요,2021-09-14T10:20:35.899+0000,5
3075,3275392538,매번재구매제품입니다 잘받았습니다 감사합니다,2021-10-06T09:47:00.719+0000,5
3076,3275365247,늘먹던거에요 잘먹을게요,2021-10-06T09:13:39.235+0000,5
3077,3290887038,그냥  유산균 먹음 좋겟지하고 믿고 먹어요,2021-10-28T02:29:17.424+0000,5
3078,3289325692,믿고 애용하는 제품이라 선물했는데 만족해합니다,2021-10-26T03:09:02.224+0000,5
3079,3271281300,늘먹던 유산균인데 새로나왓다고해서 시켜봤어요 잘먹어볼게요,2021-09-30T06:19:47.829+0000,5
3080,3298233396,매일  고있습니다,2021-11-08T01:41:43.101+0000,5
3081,3261618086,가족들과 함께 먹는 락토핏골드  좋은 가격으로 구매했습니다 부모님께도 보내드리고 우리가족 장건강도 챙기고 너무 좋아요 맛도 좋아서 아이들은 많이 먹고 싶어해요 포장도 안전하게 되어있고  빠른배송에 감사합니다,2021-09-13T23:02:45.067+0000,5
3082,3262568028,항상 먹던 제품이여서 믿고만족하며 먹고있어요,2021-09-15T04:41:18.201+0000,5
3083,3262964917,뚱보균억제가들어있다해서 이걸로계속먹고있어요 할인많이해서쟁여놓으려고구매했어요 배송도빨라요,2021-09-15T13:44:20.967+0000,5
3084,3268405277,라방혜택으로 저렴하게 구입했어요 장이 약한 남편이 꾸준히 먹고 있는데 확실히 효과 있어요,2021-09-26T13:52:52.931+0000,5
3085,3287071846,항상 애용하는 제품이어요 먹기 편하고 효과도 좋아서 다시 재구매할거여요,2021-10-22T10:29:32.637+0000,4
3086,3284416247,재주문해서 다시 한번 섭취 중 입니다 없으면 문제 생기는 아이템이라 그냥 쭉 이어 드시면 좋을 듯 합니다,2021-10-19T05:35:46.322+0000,5
3087,3265974166,명절 선물로 친척 어른들께 선물드렸는데 다들 센스있는 선물이라며 좋아하셨어요  다음에는 제가 먹을 것도 구매할 예정입니다,2021-09-22T13:48:15.543+0000,5
3088,3265973847,명절 선물로 친척 어른들께 선물드렸는데 다들 센스있는 선물이라며 좋아하셨어요  다음에는 제가 먹을 것도 구매할 예정입니다,2021-09-22T13:47:26.972+0000,5
3089,3289050501,매밀먹습니다 부모님께 선물해 드렸네요 좋습니다,2021-10-25T12:42:01.759+0000,5
3090,3276561338,필요하시분 선물로 구입했습니다,2021-10-07T21:31:08.280+0000,4
3091,3273469610,이제 유산균도 챙겨먹을 나이네요 잘 먹을듯요,2021-10-03T08:09:48.942+0000,5
3092,3281675316,맛있는 유산균이여서 너무 잘먹고있어요 하루라도 안먹으면 큰일나는줄 아는 남편이예요,2021-10-15T08:18:32.641+0000,5
3093,3278622334,잘 구매한것 같아요,2021-10-11T09:02:31.905+0000,5
3094,3262175654,엄마가 락토핏만 드셔서 추석선물로 구매했어요 라이브 방송이어서 혜택도 좋네용 락토핏 먹을때와 안먹을때가 확실히 다르다고 하시더라구요 이전에 락토핏 다 먹고 다른 유산균 제품으로 구매해서 먹었었는데 먹기가 락토핏이 훨 편하다고 ,2021-09-14T12:23:21.163+0000,5
3095,3292788011,먹기 편하고 맛있어요,2021-10-30T16:40:21.221+0000,5
3096,3282572171,가격도 아주 맘에 들고 먹기 편하고 맛도 좋아요  배송도 빠르고 포장도 꼼꼼하게 왔어요 감사합니다,2021-10-16T10:32:35.087+0000,5
3097,3266266038,추석 특가랑 라이브 이벤트 사운품도 많이하서 몇개월치 한번에 다샀어요 종근당 덕에 추석 마음이 푸근해집니다,2021-09-23T06:36:30.714+0000,5
3098,3266265815,추석 특가랑 라이브 이벤트 사운품도 많이하서 몇개월치 한번에 다샀어요 종근당 덕에 추석 마음이 푸근해집니다,2021-09-23T06:36:05.347+0000,5
3099,3266265503,추석 특가랑 라이브 이벤트 사운품도 많이하서 몇개월치 한번에 다샀어요 종근당 덕에 추석 마음이 푸근해집니다,2021-09-23T06:35:30.328+0000,5
3100,3289264949,민감해진 장에 좋기를 기대하며 먹고 있어요,2021-10-26T01:52:09.096+0000,5
3101,3297267788,감사합니다,2021-11-06T07:00:13.030+0000,5
3102,3280537111,여기진짜 제일저렴해던서,2021-10-14T03:03:37.242+0000,5
3103,3289225725,계속 가족 건강을 위해 꾸준히 먹어야 겠어요,2021-10-26T00:42:30.225+0000,5
3104,3289734365,달고 건강하니까 애들이 정말 잘 먹어요,2021-10-26T11:39:12.816+0000,5
3105,3268393282,항상먹던거라 끊기기 전에 주문했어요 담에도 다 먹으면 주문예정입니다,2021-09-26T13:31:33.863+0000,5
3106,3275663661,몇년째 매일 편리하게 먹고있습니다,2021-10-06T14:34:29.463+0000,5
3107,3293914505,솔직히효과는없는듯 ,2021-11-01T14:07:31.715+0000,4
3108,3276796271,맛도 좋고 화장실도 매일 가게되네요,2021-10-08T04:11:56.976+0000,4
3109,3284705359,먹기 편해서 잘 챙겨 먹고 있어요 가격대비 용량 많아서 좋았어요,2021-10-19T11:17:34.242+0000,4
3110,3277859536,맛도 건강도 잘 챙기고 있습니다,2021-10-09T23:55:03.205+0000,5
3111,3274918751,스틱포장도 잘 열리고 물없이도 잘 녹아서 먹기 편해요,2021-10-05T15:04:25.799+0000,4
3112,3261847662,유산균 다른거 먹어봤는데 결국 돌아왔어요 뭐니뭐니해도 유산균은 락토핏 유산균 휴대하기 좋은 사이즈 노랑노랑 귀여운 디자인 아침에 눈뜨기도 어려운 상태에서도 공복에 유산균은 먹어야 한다며 손이 갑니다 다 먹으면 또 살거에요,2021-09-14T05:00:29.690+0000,5
3113,3287243037,좋아용 아주 잘먹었습니다,2021-10-22T14:52:25.539+0000,5
3114,3285528338,맛도 좋고 먹기 편해요 꾸준히 먹으니 변비도 없어져서 좋아요,2021-10-20T11:47:54.474+0000,5
3115,3265804554,유통기한 넉넉하고 아이들도 스스로 챙겨 먹기 먹기 편하게 되어있어요 프리 프로 바이오틱스 모두 포함되어 있어 믿고 먹습니다,2021-09-22T05:06:35.840+0000,5
3116,3269450543,제가 애기 입맛이라 가루약 같은건 못먹어서 걱정했는데 맛있어서 잘 먹을수 있을것 같아요,2021-09-28T02:59:42.395+0000,5
