,id,reviewContent,createDate,reviewScore
4637,3164521472,가족들위해 준비했어요,2021-04-29T10:03:08.588+0000,5
4638,3168155062,만족합니다 ,2021-05-05T02:01:54.139+0000,5
4639,3170355296,꾸준히 먹고 있는 제품 입니다먹은 후로 화장실 편히 잘가요,2021-05-08T03:53:56.133+0000,5
4640,3175218902,아부지선물드렸어요 믿고먹어요,2021-05-14T09:59:00.336+0000,4
4641,3166756803,유통기한   까지네요,2021-05-03T00:32:39.393+0000,5
4642,3162598981,아이들과 같이 먹으려고 구매했습니다 아이들이 변비는없지만 먹고 더 수월하게 볼수있다고 하고 냄새나 맛에 민감한 아이들이라 쉽게 거부감이 들줄알았는데 맛있다고 잘챙겨 먹고있습니다,2021-04-27T01:32:20.270+0000,5
4643,3177937482,계속 먹던 거라서 좋아요,2021-05-18T10:46:07.120+0000,5
4644,3164812200,매번 잘 먹고 있습니당,2021-04-29T23:13:04.236+0000,5
4645,3163772435,늘 먹던거라 구매했어요,2021-04-28T10:18:20.388+0000,4
4646,3164881840,빠른배송 맛  다  좋아요,2021-04-30T01:13:19.629+0000,4
4647,3176042218,배송도 빠르고 꾸준히 이용하고 있어요,2021-05-15T13:38:48.275+0000,5
4648,3179334262,항상 먹는 거네요,2021-05-20T13:17:47.575+0000,4
4649,3165359907,가성비 좋습니다,2021-04-30T12:03:05.378+0000,5
4650,3164584564,믿고먹는제품이죠,2021-04-29T11:31:48.784+0000,5
4651,3194103549,조아요조아요조아요조아요,2021-06-09T23:23:57.715+0000,3
4652,3175434029,항상 종근당 락토핏 애용하고 있습니다,2021-05-14T16:49:36.616+0000,5
4653,3165360170,가성비 좋습니다,2021-04-30T12:03:31.306+0000,5
4654,3153106484,저렴하게 온가족이 잘이용하거있습니다 변도 잘보고 아이도 좋아해요 항상애용합니다,2021-04-13T05:17:58.014+0000,5
4655,3161768877,꾸준히 먹으면 효과있겠지요,2021-04-25T13:10:59.603+0000,4
4656,3164182269,배송진짜 빨라요,2021-04-29T02:04:02.457+0000,5
4657,3161851135,매일 꾸준히 챙겨먹고 있어요,2021-04-25T16:08:20.068+0000,5
4658,3177576664,배변엔 최고입니다,2021-05-18T02:03:45.700+0000,5
4659,3172778036,맛도 맛있고 가족이 다같이 먹기 좋은 제품 입니다,2021-05-11T10:11:31.349+0000,5
4660,3157637219,만족해요꾸준히 먹어야겠아여,2021-04-19T14:51:04.018+0000,5
4661,3177840901,상품 잘받았습니당,2021-05-18T08:36:33.627+0000,4
4662,3161415707,맛있습니다 잘샀어요,2021-04-25T01:25:39.150+0000,5
4663,3153000698,먹기도편하고 맛도괜찮아요   몸에좋아도 맛이 이상하면 못먹겠더라구요,2021-04-13T02:27:08.984+0000,5
4664,3168538140,정착한 유산균이예요 좋은 가격에 감사합니다,2021-05-05T16:12:41.995+0000,5
4665,3174439910,어버이날 선물로 구매했어요,2021-05-13T10:48:24.032+0000,5
4666,3174034320,유산균 콜라겐은 먹어줘야죠,2021-05-13T01:31:19.819+0000,3
4667,3169673425,잘 받았습니다 감사합니다,2021-05-07T06:02:30.454+0000,3
4668,3175274630,빠른 배송 감사합니다,2021-05-14T11:30:46.769+0000,5
4669,3173077837,먹기 편하고 냉장보관 안해서 좋아요,2021-05-11T15:45:44.957+0000,5
4670,3171145215,만족스럽네요  선물용으로 좋아요,2021-05-09T06:49:54.174+0000,4
4671,3167172521,늘 먹는 유산균인데 저렴하게 잘 산거 같아요 유통기한도 년 조금 넘어서 미리 사놓고 먹을 수 있을거 같아요,2021-05-03T11:53:17.576+0000,5
4672,3162403477,늘 믿고 먹는 락토핏이에요 제일 맛있고 목넘김도 좋아요 근데 유산균도 내성이 생기는지 전처럼 화장실이 쉽지 않네요,2021-04-26T13:00:58.470+0000,3
4673,3163268370,우선 최대 장점은 먹기 편해요 물 없이 톡 털어 넣으면 끝 맛도 좋아서 거부감이 없어요 꾸준히 먹고있어요,2021-04-27T16:37:59.749+0000,4
4674,3165247339,유산균은 믿고 먹어요 배송도 빨라서 좋아요 바로 오네요 선물하기 좋은거 같아요,2021-04-30T08:58:26.954+0000,5
4675,3173169652,배송도빠르고 항상먹어요,2021-05-11T23:48:53.454+0000,5
4676,3171572935,유산균이 필요하다 싶으면 구매합니다,2021-05-10T00:50:01.562+0000,4
4677,3167178492,선물용으로 구매했네요 늘 드시던거라 선택해봤어요,2021-05-03T12:04:29.285+0000,5
4678,3167012204,하루만에 배송왔어요 엄청 빨라요 그리고 꼼꼼하게 포장되어왔어요,2021-05-03T06:27:00.463+0000,5
4679,3167637221,계속 먹고 있던 겁니다 싸게 구입했어요,2021-05-04T07:21:26.960+0000,5
4680,3155128015,유명한 유산균 잘 받앗습니다 잘 먹어보고 괜찬으면 계속 시킬께요,2021-04-15T15:23:59.758+0000,5
4681,3174391687,필요할 때 딱 판매함,2021-05-13T09:42:39.982+0000,4
4682,3172206663,엉덩이가 시원해 지고 있어욤,2021-05-10T15:08:47.936+0000,5
4683,3164728110,완전 맛있어요 저는 잘 모르겠는데  애들은 먹으면 변 보는데 수월하다네요,2021-04-29T14:49:45.460+0000,5
4684,3172937030,역시  락토핏  맛도 조아요,2021-05-11T12:50:02.118+0000,5
4685,3171267304,항상먹던거예요 바로주문했어요,2021-05-09T10:40:35.849+0000,5
4686,3166078451,매일 하나씩 먹고 있는데 효과가 꽤 좋습니다 추천해요,2021-05-01T13:44:15.833+0000,5
4687,3172600562,맛도 있고 잘 먹고 있어요,2021-05-11T06:36:30.957+0000,5
4688,3169311118,평소 챙겨 먹는 유산균 제품이라 잘 먹고 있습니다,2021-05-06T21:17:21.848+0000,5
4689,3169460736,맛도 좋고 개수가 많아서 좋아요 잘먹겠습니다,2021-05-07T01:58:18.801+0000,5
4690,3167145343,박스 포장에 종이가방도 같이 있었음 좋았을 텐데 그부분만 아쉽네요,2021-05-03T11:01:35.497+0000,5
4691,3171965111,가족 모두 편히 먹을수 있어 좋아요,2021-05-10T08:23:33.907+0000,3
4692,3165862136,유산균 구입하려고 검색하다가 구매했어요 맛있고 먹기 편해요,2021-05-01T07:29:36.445+0000,5
4693,3155373430,장트러블생길때 지사제 효과두 있는거 같아요 좋아요,2021-04-16T02:55:44.877+0000,5
4694,3166237516,싸게 잘 샀습니다  만족합니다  다음에 또 주문할게요,2021-05-02T01:13:29.844+0000,5
4695,3164955055,우리가족 락토핏 늘 먹던 제품입니다 맛있고 효과도 좋아요,2021-04-30T02:31:01.365+0000,5
4696,3162766481,효과 진짜 좋아요 화장실 잘 못갔는데 요즘은 하루에 한번씩 꼭 갑니다 최고,2021-04-27T05:42:50.732+0000,5
4697,3142474529,지인분께 선물해 드린건데 아주 잘 드시고 있으며 다 드신후엔 직접 사서 먹고 싶다는 말씀을 하셔서 다행이구나 했습니다 만족도 면에서 선물용으로 좋은제품같아요,2021-03-28T16:46:53.243+0000,5
4698,3169658259,아이가 락토핏만 먹어서 년째 정착중입니다,2021-05-07T05:43:47.497+0000,5
4699,3164625755,잘받았어요 빠른배송으로  처음 먹어보는건데 기대되네요,2021-04-29T12:26:08.044+0000,5
4700,3164067157,언제나 먹던 유산균제품입니다 아이와 같이 잘먹겠습니다,2021-04-28T22:37:55.238+0000,5
4701,3171408230,섬물했엉가정의달선물,2021-05-09T14:13:43.070+0000,5
4702,3166341491,부모님이 좋아하시네요  저렴하게 잘 샀어요,2021-05-02T04:05:54.262+0000,5
4703,3168629623,배송도 빠르고 늘 챙겨먹고 있습니다,2021-05-06T00:53:07.509+0000,5
4704,3161115126,아주좋아요,2021-04-24T09:42:47.067+0000,5
4705,3161588163,소화기관이 약한 저에게 알맞은 제품이라고 생각합니다 잘 먹고 있습니다,2021-04-25T07:00:05.102+0000,5
4706,3170339118,선물해주니 좋아하네요,2021-05-08T03:26:11.968+0000,5
4707,3160077506,아이들이 맛있다고 저녀먹고 꼭 챙겨 먹네요 이걸 먹으니 화장실 가기 좋다고 키즈는 안 먹고 꼭 패밀리만 먹어요,2021-04-23T01:43:16.716+0000,3
4708,3145731474,대장 폴립이후  꾸준히  먹고있어요 아이들꺼도 사서  뭐든 꾸준히가 중요 한거라  애들이랑 전 일단 변비가 없어요,2021-04-02T06:43:39.698+0000,5
4709,3169782633,항상 먹는 유산균 잘 받았습니다,2021-05-07T08:12:51.114+0000,5
4710,3148598499,락토핏 저렴하게 구매 잘한거같아요  한통은 사무실에 두통은 집에 놓고 먹고있어요  다먹으면 또 주문할게요,2021-04-06T13:10:55.082+0000,5
4711,3164777084,달달하니 맛도 있고 안먹으면 장이 불편한거같아 매일 챙겨먹어요,2021-04-29T18:07:32.027+0000,5
4712,3166785021,맛도좋고 건강해지는 기분이 들어서 좋습니다,2021-05-03T01:07:19.684+0000,5
4713,3165807981,년동안 먹고 있는데 먹기도 편하고 들고 다니기도 좋고 추천해요,2021-05-01T06:10:49.161+0000,5
4714,3156512542,꾸준히 먹고있어요 좋아요,2021-04-17T16:00:30.990+0000,5
4715,3165570068,랏토핏 유산균 좋아요 매일 꾸준히 챙겨먹고 있습니다,2021-05-01T00:43:03.590+0000,5
4716,3169467470,배송 빨라서 좋아요,2021-05-07T02:05:03.053+0000,5
4717,3165142226,늘 먹던 제품입니다 감사합니다,2021-04-30T06:28:04.860+0000,5
4718,3156480253,잘먹고잇어요 맛잇어요,2021-04-17T14:32:54.825+0000,5
4719,3168457099,좋아서 계속먹고있어요,2021-05-05T13:12:06.083+0000,3
4720,3164848770,어머니선물도 온라인으로 주문하니 너무 편리하네요,2021-04-30T00:32:10.438+0000,5
4721,3152100031,간편하게 먹기 좋고 매일 챙겨먹고 있어요,2021-04-11T13:10:57.192+0000,5
4722,3161323488,좋아요,2021-04-24T16:59:41.584+0000,5
4723,3152609067,항상 챙겨먹는 제품이에요 좋아요,2021-04-12T08:17:17.333+0000,5
4724,3167587800,아주 만족해서 선물로도 주네요,2021-05-04T06:16:03.780+0000,5
4725,3165566887,친구가 좋대서 한번 바꿔볼려고 사봤어요,2021-05-01T00:37:55.471+0000,5
4726,3161318569,먹기도편리하고 맛도 좋아요   몸에도좋을꺼라 믿고있어요,2021-04-24T16:33:37.580+0000,5
4727,3168067004,엄마가 사달라 하셔서요,2021-05-04T21:39:27.554+0000,5
4728,3168882503,저렴하게 잘 샀어요,2021-05-06T07:28:29.683+0000,5
4729,3152465563,선물용으로 구매했는데 좋아요,2021-04-12T04:21:22.151+0000,4
4730,3134847318,항상 이것만 먹는다 예민하던 장도 괜챦아졌고 화장실도 잘 가는 편이다,2021-03-17T22:51:53.661+0000,5
4731,3148309517,맛있어요 꾸준히먹으면 장이 좋아지겠죠,2021-04-06T07:38:12.184+0000,5
4732,3167320861,좋아요 아주 만족합니다,2021-05-03T22:26:00.901+0000,5
4733,3166184203,아주 좋습니다 재구입하고 싶어요,2021-05-01T22:45:01.826+0000,5
4734,3165306114,항상 먹던 제품으로 빠른 배송 감사드립니다,2021-04-30T10:35:13.541+0000,5
4735,3162653677,배송도 빨라서 좋았고 선물하기 좋게 포장되어 있어서 좋았어요,2021-04-27T02:42:18.557+0000,5
4736,3165789613,믿고 보고 따지지않는 유산균입니다,2021-05-01T05:43:30.374+0000,5
4737,3167592586,매일 챙겨먹고 있습니당,2021-05-04T06:22:27.077+0000,5
4738,3166186473,좋은제품 싸게잘구매했습니다,2021-05-01T22:58:10.062+0000,5
4739,3163829401,온가족 다먹을슈 있어서 좋아요  아이들이 너무 맛있어해요 ,2021-04-28T11:30:12.811+0000,5
4740,3156146717,항상 선호하는 제품입니다  친정엄마가 부탁해서 또 했어요    quot  유산균이 정말있는지 quot  편하다고 하시네요   담에또 구매할려고요 ,2021-04-17T04:55:11.467+0000,5
4741,3183223903,감사합니다 감사합니다,2021-05-26T01:45:52.082+0000,5
4742,3183223384,감사합니다 감사합니다,2021-05-26T01:45:09.139+0000,5
4743,3183222599,감사합니다 감사합니다,2021-05-26T01:44:04.778+0000,5
4744,3166142903,선물햇는데 완전 만족해쇼,2021-05-01T16:05:19.089+0000,5
4745,3163150957,한개씩  포장되어 있어 선물하기도 편리해서 좋아요,2021-04-27T13:14:54.152+0000,5
4746,3164390841,품질이 좋고 가격도 저렴하게 구매했어요 ,2021-04-29T07:01:41.747+0000,4
4747,3167751100,빠르게 잘 받았어요 좋아요,2021-05-04T09:45:47.468+0000,5
4748,3165112469,선물 했는데  지인이 좋아했어요,2021-04-30T05:49:03.389+0000,4
4749,3166805014,좋아요 잘 쓰겠습니다,2021-05-03T01:29:07.692+0000,5
4750,3138768913,프로바이오틱스로 락토핏을 구매한 뒤로는 몇년간 계속 먹고 있은 제품입니다 맛있고 먹기에 편합니다 효과도 좋은 편이구요,2021-03-23T11:27:47.633+0000,5
4751,3166341676,양이 많아서 든든해용,2021-05-02T04:06:21.135+0000,5
4752,3150823288,항상 먹는거 잘샀네여 배송빠름,2021-04-09T10:43:05.864+0000,5
4753,3164580269,배송 빠르고 좋네요 잘 먹겠습니다,2021-04-29T11:26:07.759+0000,5
4754,3142443092,맛있어요 그리고 안 먹을 때보다 장 건강에 도움이 되는 것 같아요 벌써 통 다 먹어가요,2021-03-28T15:00:28.003+0000,5
4755,3142120425,원래 먹는 상품인데 재구매했어요 먹기편하고 효과도 좋은 것 같아 직원들이랑 공구했어요,2021-03-28T04:26:55.891+0000,5
4756,3146832780,화장실을 잘 못가서 산건데 한달 먹었는데 아직까진 잘 모르겠어요,2021-04-04T00:28:28.683+0000,3
4757,3164273420,상상먹는 제품이라 믿고 먹어요 맛있어요,2021-04-29T04:25:37.616+0000,5
4758,3157863853,좋은거같아요  아이들신랑잘챙겨먹네요   재주문했어요  년치,2021-04-20T03:41:20.762+0000,5
4759,3164714585,맛있고 좋아요 배송도빠르고요,2021-04-29T14:25:51.591+0000,5
4760,3164081476,배송도 빠르고 포장상태도 아주 좋습니더,2021-04-28T23:22:16.327+0000,5
4761,3164714880,배송빠르고 포장 꼼꼼합니다,2021-04-29T14:26:20.829+0000,4
4762,3165015654,배송빠르고 맛도좋아요,2021-04-30T03:39:08.613+0000,5
4763,3142837952,매일 꾸준히 챙겨먹고있어요 맛도 좋고 먹기 편해서 확실히 잘 먹게 되는 것 같아요 추가 구매 예정입니다,2021-03-29T07:03:04.029+0000,5
4764,3164907747,먹기편하고 맛도 좋아요,2021-04-30T01:42:07.210+0000,5
4765,3165334010,꾸준히 잘 먹고 있어요,2021-04-30T11:21:45.135+0000,4
4766,3150765076,먹기도좋고 선물하기도 좋습니다,2021-04-09T09:10:01.754+0000,5
4767,3140914986,유산균은 개월이상 먹어야 효과 있다해서 열심히 먹고 있어요 아직까진 잘 모르겠지만 ,2021-03-26T06:46:42.610+0000,4
4768,3162387874,맛있어서 온가족 간식처럼 먹고있어요,2021-04-26T12:32:49.310+0000,5
4769,3165180070,정말 졸 쓰고있어요,2021-04-30T07:19:05.241+0000,5
4770,3148337909,건강에 좋아요 맛도 좋아요,2021-04-06T08:15:59.963+0000,5
4771,3180608532,좋아요 아주 좋아요,2021-05-22T08:01:56.054+0000,5
4772,3146770999,옷이 너무 좋아요 다음애 또,2021-04-03T16:33:39.533+0000,5
4773,3164271118,광고 보고 믿고 샀어요,2021-04-29T04:22:18.529+0000,5
4774,3164643141,빠른배송 감사합니다,2021-04-29T12:48:27.932+0000,5
4775,3160554682,항상 잘 먹고 있어요 장건강,2021-04-23T12:14:31.202+0000,5
4776,3163920872,항상 먹던 제품입니다,2021-04-28T13:16:26.815+0000,5
4777,3164920435,좋습니다만족해요,2021-04-30T01:55:32.713+0000,5
4778,3163067562,만족스럽습니다 좋네요,2021-04-27T11:50:03.059+0000,5
4779,3163168504,배송 빠르니 좋네요 굿,2021-04-27T13:34:05.964+0000,5
4780,3139001964,처음으로 먹기 시작했는데 하루 번은 꼭 배변을 편하구  하네요 아주 만족합니다,2021-03-23T17:10:30.753+0000,5
4781,3108776104,늘 이것만 먹게돼요설명절기획으로 구매했어요세통개에요오개월치라서  든든하네요일단 먹기편해서  좋아요,2021-02-07T02:42:22.236+0000,5
4782,3148594355,가성비 좋은 유산균,2021-04-06T13:06:37.309+0000,5
4783,3141449754,화장실 가기 좋아요 맛나서 계속 손이갑니다,2021-03-27T03:16:05.017+0000,5
4784,3140104356,배송도 빠르고 포장상태도 괜찮았어요 근데 쇼핑백이 없어서 아쉽네요,2021-03-25T06:16:58.801+0000,5
4785,3142872909,선물로 한통 받고 아이들이 좋아해서 구매하게되었네요,2021-03-29T08:07:38.854+0000,5
4786,3142999137,먹기 편리해서 좋아요,2021-03-29T12:14:37.207+0000,5
4787,3113465843,딸아이가 용돈으로  타사  제품이 싸다고  먹길래  좀 맘이 안좋았는데 다 먹어가서  깜짝선물로 구입해서  주니 넘 좋아하네요 전에 먹던것은  맛이 별로라  먹고 바로 물을 먹었는데  락토핏은  먹고 바로 물을  마시지 않아도  맛있어 좋다고 하네요  좋아 하고 꼬박 꼬박 먹는걸보니 넘 선물 잘고른듯해서 뿌듯해요   한가지  넘  아쉬운것은 방송중 엄청 혜택 좋은줄 알고  사은품  줄지 알았거든요  문의해보니 적용 상품 아니라고 구입했서 좀 속상했어요 타사에서 이것보다 사실 셰땍이 좀 나았는데 사은품에 혹 했는데 잘 못 봤다니    그래도 잘 먹는 딸아이 보며  잊고 있답니다,2021-02-16T12:24:09.314+0000,5
4788,3161194785,새일할따 잘 마러여농,2021-04-24T12:08:35.252+0000,5
4789,3161142467,배송이 빠르고 제품이 좋아요,2021-04-24T10:34:27.904+0000,5
4790,3148428165,항상 먹던건데 다른 유산균 먹다가 다시 먹으려고 구입했어요 먹기 편하고 맛도 좋아서 부담없이 잘 먹고 있어요,2021-04-06T10:12:05.633+0000,5
4791,3142806278,장건강에 도움이 된다하여 꾸준히 먹고 있어요,2021-03-29T06:07:47.556+0000,5
4792,3161509034,넉넉해서 좋아요 맛있구요,2021-04-25T04:01:10.961+0000,5
4793,3146817156,변함없는 좋은제품,2021-04-03T23:43:22.396+0000,5
4794,3134322651,평소에 먹던 거여서 주문했어요 배송은 이틀정도 걸려서 왔고 포장도 꼼꼼합니다,2021-03-17T05:57:19.919+0000,5
4795,3151383778,아이들이 처음먹는 유산균인데효과좋아서계속 먹었으면 좋겠어요,2021-04-10T08:03:55.642+0000,5
4796,3154785352,잘먹고 있어요또 구매예정입니다,2021-04-15T07:27:33.599+0000,5
4797,3141730954,정말 맛있고 꾸준히 먹으면 효과 있는거 같습니다,2021-03-27T10:29:08.347+0000,5
4798,3156910755,항상 먹던거라 주문해서 잘먹고있습니다,2021-04-18T11:40:28.194+0000,5
4799,3131208185,아내와 매일 스틱 한개씩 섭취하고 있습니다 맛 좋구요 유산균 섭취를 쉽게 생활화 할 수 있어서 좋습니다 좋은 제품이네요 추천합니다,2021-03-12T12:15:52.247+0000,5
4800,3159344257,맛도괜찮고 먹기도 편하네요,2021-04-22T02:10:13.937+0000,4
4801,3133821571,식탁위에 올려놓고 기억하며 매일 먹고잇어요 온가족이 함께 먹을 수 있어 좋네용,2021-03-16T11:56:05.144+0000,5
4802,3143744313,한 달 넘게 잘 먹고 있어요,2021-03-30T13:11:30.064+0000,5
4803,3143348048,쌓아두고 먹는 제품이에요,2021-03-30T04:51:13.796+0000,4
4804,3141089343,잘 쓰고 있어요 감사합니다,2021-03-26T11:15:05.794+0000,4
4805,3158230416,넉넉하게 먹기좋아요,2021-04-20T11:44:20.664+0000,5
4806,3148043308,맛도 좋고 먹기가 편해서 좋아요 아침마다 온가족이 하나씩 먹고 잇어요,2021-04-06T01:09:17.882+0000,4
4807,3134969055,하루에 하나씩 꾸준히 먹고 있습니당 속편하고 좋은거 같아요,2021-03-18T02:06:53.630+0000,5
4808,3136627100,보내준다던 사은품이 하나도 안와서 맘 상했는데 그냥 먹어보고 있네요,2021-03-20T05:31:07.136+0000,3
4809,3141252062,요새도 잘 먹고 있는중입니다,2021-03-26T17:00:32.020+0000,5
4810,3134668585,온가족 챙기는  맛있는   유산균 한포  먹기도 간편휴대도 간편  떨어지면 재구매,2021-03-17T12:52:58.991+0000,5
4811,3133151022,상품 설명에는 추가 선물을 주는 것처럼 되어 있는데 이 제품은 아니었습니다 여기보다 다른 곳이 더 저렴했어요,2021-03-15T13:02:02.047+0000,1
4812,3142083230,꾸준히 잘먹고 있답니다,2021-03-28T03:12:23.685+0000,5
4813,3153848183,할아버지 사드렸는데 좋아하시네요,2021-04-14T04:12:45.431+0000,5
4814,3139377113,계속먹는중입니다 먹기편리해요,2021-03-24T07:29:18.159+0000,5
4815,3131247824,아들이 시켜달래서 먹는 중인데  잘 먹어요 장건강은  맡겨두어도 되죠 잘샀습니다,2021-03-12T13:14:57.803+0000,5
4816,3140941280,편리하고 맛도 좋아요,2021-03-26T07:22:55.702+0000,5
4817,3134122727,하루 하나씩 먹고 있어요 조만간에 또 주문해야겠네요 ,2021-03-17T00:57:11.174+0000,5
4818,3147550299,남편 먹을거 선물드리려고 구매했는데 남편도 선물 받으신 분도 아주 만족스러워해주셔서 기분좋은 선물이었습니다,2021-04-05T03:23:14.748+0000,5
4819,3138794919,두번째 주문입니다 잘먹고있습니다,2021-03-23T11:54:08.874+0000,5
4820,3139458785,좋아요 먹기도 좋네요,2021-03-24T09:10:26.787+0000,5
4821,3145295217,유산균은 엄청 좋은 것보다 가성비 괜찮은 걸 꾸준히 먹어야 효과가 좋다는데 락토핏이 제일 딱인것 같아요  먹은날 안먹은 날 정말 달라요,2021-04-01T14:38:16.710+0000,5
4822,3107945698,라이브방송 보면서 포증정 및 사은품 증정 이벤트 보고 샀는데 믿고 네이버쇼핑 첫 구매 였는데 받고나니 제품만 배달되었네요   사은품 조건이 안 될 줄 알았으면 안 샀을 거 같아요 전에는 타 사이트에서 개 분량을 쿠폰 사용해서 비슷한 가격에 구매했었습니다 다음엔 속지말고 최저가 검색해서 사야겠습니다,2021-02-06T00:04:23.699+0000,1
4823,3154981326,제품 배달 모두 만족해요,2021-04-15T11:53:04.181+0000,5
4824,3109275159,이번에 번째구매해서 먹어봄 유산균이라 나쁘지않고 개정도는 그냥 먹게됨 맛있음   항상 구매할것 같음,2021-02-07T22:56:01.773+0000,5
4825,3133141214,유산균 꾸준히먹고있어요 젤 효과가좋은것같고 가격도 진짜저렴해서 부담없이 먹기좋은것같네요,2021-03-15T12:45:52.856+0000,5
4826,3134500513,선물했는데 좋아하셨어요 만족합니다,2021-03-17T09:42:36.681+0000,4
4827,3136158844,부모님께 선물했는데 효과가 아주 좋다고 하셨어요,2021-03-19T11:21:53.586+0000,5
4828,3152338004,선물용으로 구매했는데 좋네요,2021-04-12T01:47:06.558+0000,5
4829,3141687289,항상 챙겨묵지용,2021-03-27T09:13:27.034+0000,5
4830,3129528415,브랜드믿고 구매해서 잘 먹고 있습니다습관처럼 유산균을 먹어 안먹음 섭섭함,2021-03-10T10:53:39.122+0000,4
4831,3134750304,부모님이 만족하시네요 잘 먹고 있어요,2021-03-17T14:33:09.017+0000,5
4832,3132827204,종근당 유산균만 먹어용 온가족 건강 지키는 유산균 공복에 꼭 챙겨먹어용 앞으로도 구매의사 있습니당,2021-03-15T03:23:56.672+0000,5
4833,3147426446,자주 구입하는 제품입니다 믿고 먹고있어요,2021-04-05T01:02:05.480+0000,5
4834,3153068812,꾸준히 잘 챙겨먹고 있어요,2021-04-13T04:18:39.754+0000,4
4835,3139656437,꾸준히 잘 먹고있습니다,2021-03-24T13:05:06.245+0000,5
4836,3152638086,화장실가기 편해졌어요,2021-04-12T09:13:48.796+0000,4
4837,3139225584,평소 먹던 유산균이라 믿고 구매했어요 유산균 제품들 중에 느끼한 고런 맛이 나는 것들이 있는데 락토핏은 포도맛이 나는 달콤한 맛이라 호불호 없이 먹기 좋은 것 같아요,2021-03-24T04:06:52.523+0000,5
4838,3136990322,잘먹고있어요 감사해요,2021-03-20T15:35:57.487+0000,5
4839,3140782502,시어머니 받아도 별 반응없더니 얼마전에 가니깐 잘 드시고 계시더군요떨어지기전에 또 사드려야겠어요 담엔 주황색통으로요,2021-03-26T03:47:37.801+0000,4
4840,3133665576,먹기도 편하고 아주 좋아요 가격도 저렴하구요,2021-03-16T08:53:08.393+0000,5
4841,3140609500,매번 먹어요 좋아요,2021-03-26T00:39:01.231+0000,5
4842,3137114382,역시 믿고 먹는 종근당 유산균,2021-03-21T01:40:57.480+0000,5
4843,3112090608,기존에 먹던 제품인데 유산균은 가끔씩 바꿔주는게 좋다고 해서 달 주기로 바꿔서 먹고있는 중이에요 근데 락토핏에 길들여졌는지 다른제품 먹을때는 억지로 먹게 되는데 락토핏은 저절로 손이 가요  명절이라 양가 부모님들 선물로 구매했는데 손잡이 선물상자 너무 좋네요  좋은 선물이 됐습니다,2021-02-14T00:55:05.830+0000,5
4844,3151986101,효과가 좋은 것 같습니다,2021-04-11T09:43:09.206+0000,4
4845,3167292067,맛도 귿 영양도 귿,2021-05-03T16:30:32.133+0000,5
4846,3129187795,잘 먹고 있네요 통이 딱딱해서 연필 꽂이로도 좋네요  번창하세요,2021-03-10T03:24:58.779+0000,5
4847,3132414387,락토핏은 처음먹어보는데 맛이 완전 좋아요 앞으론 락토핏으로 먹어야겠어요,2021-03-14T10:51:07.594+0000,5
4848,3144514008,부모님 선물로 좋아하셧어요 재 구매의사 있습니다,2021-03-31T13:34:54.507+0000,5
4849,3136983677,꾸준히챙겨서먹고있어요,2021-03-20T15:18:41.995+0000,5
4850,3132355451,장 건강을 위해서 매일 꾸준히 년 째 종근당 먹는데 만족합니다,2021-03-14T08:43:02.639+0000,5
4851,3141883909,한달 꾸준히 먹어보니  확실히 변화가 생기기 시작하는거 같아요 기분탓인지는 모르겠지만 먹은후부턴 좋아지는 느낌,2021-03-27T15:01:41.396+0000,5
4852,3129995805,매일 먹고싶어요 세번째 여기서 구매하고있어요,2021-03-11T03:38:11.170+0000,5
4853,3142731302,저렴하게 잘산편이에요 근데 전 노랑이보다 연두가 더 좋은듯 ,2021-03-29T04:10:24.135+0000,3
4854,3143793948,맛있고 몸이 좋다 생각해서 또 구매했어요 많이 파세요,2021-03-30T14:07:54.519+0000,5
